acreage,address,bathroom,bedroom,code,date,description,direction,link_image,name_contact,phone_contact,price,project,title,type,url_page
 57 m,"Địa chỉ: Đường Nguyễn Văn Huyên, Phường Quan Hoa, Cầu Giấy, Hà Nội",,,715991,"Thứ năm, 14:30 07/12/2023","Chính chủ cho thuê MBKD tầng 1 phố Nguyễn Văn Huyên. DT: 57m2; MT: 6m, có sân riêng để xe 50m2. Nhà thiết kế hiện đại, nội thất đầy đủ. Vỉa hè rộng 8m, gần ngã 4, gần Tòa nhà chung cư, văn phòng, trường học. Chỗ đỗ xe thuận tiện. (không KD ngành hàng ăn, nhậu)",,https://bds123.cdn.static123.com/images/thumbs/900x600/fit/2023/08/31/screenshot-20161104-115343_1693471274.png,Phúc An, 0906266066, Thỏa thuận,Tin thường, Chính chủ cho thuê tầng 1 nhà mặt phố Nguyễn Văn Huyên - Quan Hoa - Cầu Giấy Hà Nội ,1,https://bds123.vn/chinh-chu-cho-thue-nha-mat-pho-nguyen-van-huyen-quan-hoa-cau-giay-ha-noi-pr715991.html
 30 m,"Địa chỉ: 149/22 Đường Lê Thị Riêng, Phường Bến Thành, Quận 1, Hồ Chí Minh",,,448660,"Chủ nhật, 14:33 03/12/2023","Homestay ở ghép ngay trung tâm Phường Bến Thành, Quận 1 với đầy đủ tiện nghi chỉ 1,6 triệu/1 người,(giá thuê này bao gồm miễn phí tất cả: điện, nước, internet, vệ sinh dọn phòng 4 ngày/ tuần và tất cả tiện nghi máy lạnh 24/24, tủ lạnh, máy lọc nước uống, máy giặt, máy sấy khô quần áo, phòng Bếp nấu ăn riêng dùng chung cho cả nhà…) ,HẼM LỚN XE TẢI ĐẾN TẬN CỬA NHÀ, PHÒNG NGỦ CÓ NHÀ VỆ SINH RIÊNG TỪNG PHÒNG ,✅Giờ giấc tự do, không ở chung chủ ,. Địa chỉ: 149/22 Lê Thị Riêng, phường bến thành, Quận 1(thông với hẽm 150 Nguyễn Trãi và Tôn Thất Tùng) ,. Tiện ích xung quanh:,+ Chỉ 5 phút đi bộ xung quanh là đến: KS New World, ĐH Hoa Sen, phố thời trang Nguyễn Trãi, phố Tây Bùi Viện, công viên Tao Đàn, Bến xe Bus TpHCM, nhà thờ Huyện Sĩ, chợ Thái Bình, CoopMart Cống Quỳnh …) ,. An ninh, an toàn:,+ Trang bị hệ thống báo động khi quên đóng cửa nhà,+ Cửa vào nhà kiểm soát bằng vân tay,+ 8 camera an ninh 24/24 toàn bộ nhà,+ Wifi tốc độ cao modem 5G riêng mỗi phòng ,+ Gía thuê: Trọn gói 1,6 triệu/người (không bao gồm xe máy) ,+ Hợp đồng 06 tháng. Đặt cọc 2 triệu.",,https://bds123.cdn.static123.com/images/thumbs/900x600/fit/2022/06/27/a078aad3-bb66-4707-9dd2-62e2d4bb311c_1656298050.jpg,Hong Giang Nguyen, 0948733302," 1.6 ,triệu/tháng",Tin thường," Homestay giường tầng chỉ 1,6 triệu/ giường bao gồm điện, nước, net, vệ sinh phòng… ",1,https://bds123.vn/homestay-giuong-tang-chi-16-trieu-giuong-bao-gom-dien-nuoc-net-ve-sinh-phong-pr448660.html
 25 m,"Địa chỉ: Đường Bùi Hữu Nghĩa, Phường 2, Bình Thạnh, Hồ Chí Minh",,,747618,"Thứ ba, 14:35 05/12/2023","-Địa chỉ: Bùi Hữu Nghĩa, Phường 2, Bình Thạnh,GIÁ 6trxxxx,- Phòng full nội thất, ra vào vân tay,- Có máy giặt riêng, sân phơi rộng,- Thang máy,- Giờ giấc tự do, PCCC Đạt tiêu chuẩn,- Free 2 xe,-Call/Zalo: 0938.634.880 để được xem phòng ❤️",,https://bds123.cdn.static123.com/images/thumbs/900x600/fit/2023/11/05/1698896031629-394-1_1699169149.jpg,Vy Nguyen, 0931845042," 6.8 ,triệu/tháng",Tin miễn phí," Studio full nội thất, siêu xinh giá chỉ 6trxx, lầu 2, free 2 xe ",1,https://bds123.vn/studio-full-noi-that-sieu-xinh-gia-chi-6trxx-lau-2-free-2-xe-pr747618.html
 30 m,"Địa chỉ: Đường Cách Mạng Tháng Tám, Phường 11, Quận 3, Hồ Chí Minh",,,747613,"Thứ ba, 14:36 05/12/2023","Địa chỉ: Cách Mạng Tháng 8, Quận 3,-Phòng nội thất: máy lạnh, tủ quần áo, kệ chén, tủ bếp, ( máy giặt, máy sấy chung ),-Thang máy hiện đại, an toàn,-Phòng mới xây rộng rãi, siêu sạch đẹp,-Bãi giữ xe rộng rãi,-Khu vực an ninh, camera 24/7,Giờ Giấc Tự do - Không chung Chủ,Call/Zalo: 0938.634.880 để được tư vấn miễn phí và dắt đi xem phòng",,https://bds123.cdn.static123.com/images/thumbs/900x600/fit/2023/11/05/1698655107890-122-3_1699168782.jpg,Vy Nguyen, 0931845042," 7 ,triệu/tháng",Tin miễn phí," Cho thuê gấp căn Studio Full nội thất, cửa sổ giếng trời thoáng đãng, giá chỉ 7tr, ở ngay Trệt ",1,https://bds123.vn/cho-thue-gap-can-studio-full-noi-that-cua-so-gieng-troi-thoang-dang-gia-chi-7tr-o-ngay-tret-pr747613.html
 40 m,"Địa chỉ: Đường Ung Văn Khiêm, Phường 25, Bình Thạnh, Hồ Chí Minh",,,747616,"Thứ ba, 14:36 05/12/2023","Chính chủ cần cho thuê,- Ung Văn Khiêm, Bình Thạnh,Dạng 1PN tách bếp có bancol rộng,-Rộng hơn 40m2, kệ tủ bếp ngoài bancol nấu ăn không lo ám mùi, diện tích rộng rãi như một không gian bếp.,- Máy lạnh, Tủ lạnh, Tủ quần áo, Giường nệm, ... Chỉ việc xách vali vào ở,-Không giới hạn người ở, thiết kế 1PN tách bancol thoáng mát,-Giờ tự do,Không chung chủ",,https://bds123.cdn.static123.com/images/thumbs/900x600/fit/2023/11/05/1698988212746-83-1_1699168963.jpg,Vy Nguyen, 0931845042," 6 ,triệu/tháng",Tin miễn phí," Chính chủ cần cho thuê phòng, 1PN, rộng hơn 40m2 giá hạt dẻ ",1,https://bds123.vn/chinh-chu-can-cho-thue-phong-1pn-rong-hon-40m2-gia-hat-de-pr747616.html
 119 m,"Địa chỉ: Đảo Kim Cương - Diamond Island - Phường Bình Trưng Tây, Quận 2, Hồ Chí Minh, Việt Nam", 2 wc , 3 pn ,746666,"Thứ sáu, 14:41 03/11/2023","Căn hộ 3PN tại dự án Diamond Island,Diện tích: 119m2,GIá chưa bao gồm phí quản lý: 21.000VNĐ/Tháng/m2 (chưa gồm VAT),Tiện ích đa dạng như hồ bơi, sân thể thao, nhà hàng, khu vui chơi trẻ em, thư viện, công viên chạy bộ ven sông, bến du thuyền,...,Anh/chị có nhu cầu, quan tâm vui lòng liên hệ để biết thêm chi tiết.", Nam ,https://bds123.cdn.static123.com/images/thumbs/900x600/fit/2023/11/03/z4844478857925-146f62576db4ffcfa3ccccc994b480bb_1698996722.jpg,Lê Quang Sáng, 0935772904," 30 ,triệu/tháng", Đảo Kim Cương - Diamond Island , Căn hộ View sông 3PN Diamond island Q.2 ,1,https://bds123.vn/can-ho-view-song-3pn-diamond-island-q2-pr746666.html
 35 m,"Địa chỉ: Số 10 Đường Trung Yên 6, Phường Yên Hòa, Cầu Giấy, Hà Nội",,,750022,"Thứ bảy, 14:46 09/12/2023","Mình cho thuê tầng 1, một phòng tầng 3 trong tòa nhà 5 tầng tại đường Trung Yên 6, Yên Hòa, Cầu Giấy, Hà Nội.,Cụ thể như sau:,+ Tầng 1: thông sàn, diện tích 85m2, có phòng vệ sinh riêng, nhà tại khu văn phòng, rất thích hợp mở quán cafe, khu trưng bày sản phẩm... Giá thuê 11 triệu,+ Phòng tầng 3: 35m2, giá thuê 4 triệu.,Đường ô tô tránh, xe tải vào được, chỗ đỗ xe ô tô thoải mái, miễn phí, phòng vuông vắn, siêu đẹp, siêu thoáng. Khu vực xung quanh là khu văn phòng, tiện ích đầy đủ như ăn uống, ngân hàng, công chứng, rất thuận tiện đi lại.,ĐT: 0941194725",,https://bds123.cdn.static123.com/images/thumbs/900x600/fit/2023/11/09/z4791645229673-bdc87e4c92051156666255fce12d0172_1699515652.jpg,Hồ Thị Thơ, 0941194725," 4 ,triệu/tháng",Tin miễn phí," Cho thuê mặt bằng kinh doanh, văn phòng tại đường Trung Yên 6, Yên Hòa, Cầu Giấy ",1,https://bds123.vn/cho-thue-mat-bang-kinh-doanh-van-phong-tai-duong-trung-yen-6-yen-hoa-cau-giay-pr750022.html
 74 m,"Quận 10, Hồ Chí Minh", 2 wc , 2 pn ,756980,"Thứ tư, 14:40 22/11/2023","Đang cần cho thuê căn hộ Rivera Park, 7/28 Thành Thái, P.14, Q.10, nhiều dịch vụ tiện ích: hồ bơi, gym, siêu thị, phòng đọc sách, …view đẹp, diện tích 74m2, 2 phòng ngủ, 2 toilet, nội thất cơ bản (bếp từ, máy hút mùi, máy lạnh, máy nước nóng, tủ giày, rèm cửa, bếp, tủ kệ bếp,...), giá 15tr/th. Liên hệ xem nhà 24/7: Linh 0902505279",,https://bds123.cdn.static123.com/images/thumbs/900x600/fit/2023/11/22/z2121431912342-7d70ce4e021dce39a1530fc6fd48c21e_1700638248.jpg,Đặng Linh, 0902505279," 15 ,triệu/tháng", Rivera Park Sài Gòn ," Đang cần cho thuê căn hộ Rivera Park, 7/28 Thành Thái, P.14, Q.10, 15tr ",1,https://bds123.vn/dang-can-cho-thue-can-ho-rivera-park-7-28-thanh-thai-p14-q10-15tr-2-pr756980.html
 30 m,"Địa chỉ: Đường Trương Quyền, Phường 6, Quận 3, Hồ Chí Minh",,,747610,"Thứ ba, 14:36 05/12/2023","Vị trí: Trương Quyền, Phường 6, Quận 3,-Nội thất: Kệ bếp và bếp điện, máy lạnh, tủ lạnh, tủ quần áo, giường ,Toilet riêng từng phòng.,- Không chung chủ,- Khu vực an ninh ,- Khu máy giặt và sân phơi rộng, Liên hệ xem phòng: ,☎️(Zalo/call): 0938.634.880",,https://bds123.cdn.static123.com/images/thumbs/900x600/fit/2023/11/05/1698752073619-246-8_1699168606.jpg,Vy Nguyen, 0931845042," 8.5 ,triệu/tháng",Tin miễn phí," STUDIO FULL NỘI THẤT, 8trx, chủ cho thuê gấp, lầu 1 ",1,https://bds123.vn/studio-full-noi-that-8trx-chu-cho-thue-gap-lau-1-pr747610.html
 372 m,"Địa chỉ: Số 24 Đường số 7, Phường An Phú, Quận 2, Hồ Chí Minh",,,756381,"Thứ năm, 14:50 21/12/2023","1. Địa chỉ: 24 Đ. Số 7, Khu đô thị An Phú An Khánh, Thủ Đức, Thành phố Hồ Chí Minh. Khu văn minh sạch sẽ, quán ăn nhà hàng, cafe đầy đủ tiện ích. Thích hợp làm công ty hoặc spa...,2.Diện tích sàn xây dựng: 372m2 - gồm 3 tầng + hầm + sân thượng. Đầy đủ phòng họp, phòng CEO, phòng Trưởng Phòng, phòng nhân viên lớn nhỏ....,3. Giá: 45 triệu/ tháng - thương lượng ít.,4. Nhà được sơn mới toàn bộ, tầng trệt lót sàn gỗ Amstrong Mỹ, các tầng còn lại lót full thảm cao cấp nhập khẩu, phòng họp, phòng nhân viên cửa kính inox Xingfa cách âm cao, máy lạnh, đèn điện thay mới 100%, WC sạch sẽ, có phòng Studio, sân thượng rộng thoáng. Internet wifi mỗi tầng đầy đủ, vào sử dụng ngay.,5. Hợp đồng thuê 2 năm.,6. Thanh toán 1 tháng cọc 3 tháng.,Văn phòng công ty được thiết kế với không gian thoáng rộng, thiết kế mở ánh sáng tự nhiên, garage thoáng mát, đường trước nhà rộng rãi. Văn phòng nằm trong khu an ninh, không ngập nước, thuận tiện giao thông đi lại. Gần các tuyến đường lớn như Song Hành, Nguyễn Quý Cảnh, Vũ Tông Phan, Trần Lựu, Lương Định Của, Mai Chí Thọ. Thuận tiện giao thông đến các quận lân cận như quận 1, quận Bình Thạnh, quận 9,...",,https://bds123.cdn.static123.com/images/thumbs/900x600/fit/2023/11/21/z4876509642714-6fe4c510d8faec8d2bf7dc5b2962f8b4-copy_1700549019.jpg,BinhGiang Nguyen Dinh, 0917871309," 45 ,triệu/tháng",Tin miễn phí," Cần cho thuê văn phòng mới, sạch sẽ khu vực An Phú, Thủ Đức - Diện tích 372m2, giá 45 triệu/tháng ",1,https://bds123.vn/can-cho-thue-van-phong-moi-sach-se-khu-vuc-an-phu-thu-duc-dien-tich-372m2-gia-55-trieu-thang-2-pr756381.html
 94 m,"Địa chỉ: The Sun Mễ Trì - Đường Phạm Hùng, Xã Mễ Trì, Quận Nam Từ Liêm, Hà Nội", 2 wc , 3 pn ,759658,"Thứ hai, 14:55 27/11/2023","Cho thuê chung cư The Sun Mễ Trì,Diện tích căn hộ 94m, 2 phòng ngủ + 1 phòng đa năng,- Nội thất được trang bị đầy đủ khách chỉ việc sách vali đến ở,- Căn hộ đang trống có thể nhận nhà ở ngay,- Quý khách liên hệ để được tư vấn và xem nhà thực tế",,https://bds123.cdn.static123.com/images/thumbs/900x600/fit/2023/11/27/z4834988564712-73925b4a8a459789a498fe50f2c4cdd7_1701070792.jpg,Lê Sơn, 0915651569," 16 ,triệu/tháng", The Sun Mễ Trì , Cho thuê căn hộ chung cư The Sun Mễ Trì Hạ 2PB + 1 đủ đồ nhận nhà ở ngay ,1,https://bds123.vn/cho-thue-can-ho-chung-cu-the-sun-me-tri-ha-2pb-1-du-do-nhan-nha-o-ngay-pr759658.html
 35 m,"Địa chỉ: 26/42 Đường Tân Sơn Nhì, Phường Tân Sơn Nhì, Tân Phú, Hồ Chí Minh",,,656385,"Thứ năm, 13:32 30/11/2023","Phòng căn hộ mini DT: 35m2 thiết kế rất đẹp với giá rất mềm so với cùng phân khúc phòng cho thuê trong khu vực.,- Thiết kế dạng căn hộ 1 Phòng Ngủ, Phòng Khách CÓ khu bếp nấu ăn riêng, đặc biệt có cửa sổ View Ban Công mặt tiền riêng trong phòng ngủ.,+ Phòng đã được trang bị sẵn:,- Máy lạnh inverter tiết kiệm điện.,- Giường và Tủ bếp gỗ hiện đại, có bồn rửa chén tiện lợi cho bạn nấu những bữa ngon.,- Máy giặt dùng miễn phí.,- Nhà vệ sinh dễ thương có bồn rửa mặt, gương.,- Ra vào bằng cửa vân tay.,- Nhà có nhà để xe, cùng hệ thống camera, đảm bảo an ninh từng phòng.,•Vị trí thuận lợi: Gần chợ Võ Thành Trang (Bà Quẹo), siêu thị PANDORA City, ETOWN Cộng hòa, Bện Viện Mỹ Đức, và Gần nhiều trường đại học, ngay mũi tàu Trường Chinh, tiện đi lại mọi nơi trong thành phố.,- Khu dân trí cao, với rất nhiều quán cafe, khu ẩm thực với nhiều quán nổi tiếng ngon, rẻ.,- Là nơi lý tưởng cho một gia đình nhỏ, nhân viên văn phòng hoặc sinh viên …,Giá chỉ: 3.9 Triệu/tháng. (Tiền phòng giảm sâu và cam kết không tăng giá),+ Địa chỉ: MT Trường Chinh, Phường Tân Sơn Nhì, Quận Tân Phú (MT sau: 26/42 Tân Sơn Nhì, Q.Tân Phú).,- Điện thoại: 0937554570 (A.Hoàng),Từ Khoá: Phòng cho thuê quận tân phú, căn hộ dịch vụ quận Tân Phú, cho thuê phòng trọ đường Tân Sơn Nhì, Q.Tân Phú ….",,https://bds123.cdn.static123.com/images/thumbs/900x600/fit/2023/07/11/d2153cfe4f73822ddb62_1689040468.jpg,Hoang Le, 0937554570," 3.9 ,triệu/tháng",Tin thường," Căn hộ mini 35m2 - 1PN, 1 PK - 26/42 Tân Sơn Nhì, Quận Tân Phú. (View ban công - Có Thang Máy). ",1,https://bds123.vn/can-ho-mini-30-40m2-1pn-1-pk-26-42-tan-son-nhi-quan-tan-phu-co-thang-may-pr656385.html
 132 m,"Địa chỉ: Hùng Vương Plaza - 126 Đường Hồng Bàng, Phường 12, Quận 5, Hồ Chí Minh", 2 wc , 3 pn ,745997,"Thứ năm, 13:46 02/11/2023","Cho thuê căn hộ Hùng Vương Plaza, 126 Hồng Bàng, Q.5, lầu cao, view thoáng mát, diện tích 132m2, 3 phòng ngủ, 3 toilet, nội thất đầy đủ (tivi, tủ lạnh, máy giặt, giường, nệm, bàn ăn, máy lạnh, máy nước nóng, rèm cửa,…) giá 20tr/th, nhận nhà ở ngay, có chỗ để xe ô tô. Liên hệ xem nhà 24/7:0326648444",,https://bds123.cdn.static123.com/images/thumbs/900x600/fit/2023/11/02/z4796831689797-b70cf6753b30587422c1d843a40c223a_1698907116.jpg,Nguyễn Trường, 0326648444," 20 ,triệu/tháng", Hùng Vương Plaza ," Cho thuê căn hộ Hùng Vương Plaza, 126 Hồng Bàng,Trung Tâm Thương Mại Q.5, 132m2, 20tr ",1,https://bds123.vn/cho-thue-can-ho-hung-vuong-plaza-126-hong-bangtrung-tam-thuong-mai-q5-132m2-20tr-pr745997.html
 15 m,"Địa chỉ: Đường Trần Hưng Đạo, Phường Hải Cảng, Quy Nhơn, Bình Định",,,756368,"Thứ năm, 13:32 21/12/2023","Mặt bằng cho thuê kinh doanh thuốc tây, sửa chữa điện thoại, siêu thị mini, tạp hóa, thời trang, buôn bán đồ khô - đặc sản vùng miền.,Diện tích khoảng 15m2,Vị trí gần Bệnh viện mắt, chợ Quy Nhơn, biển Quy Nhơn",,https://bds123.cdn.static123.com/images/thumbs/900x600/fit/2023/11/21/at-chon3_1700547954.jpg,NGÔ QUỐC HÙNG, 0906091829," 3.5 ,triệu/tháng",Tin miễn phí, Mặt bằng cho thuê gần Bệnh viện mắt Bình Đình ,1,https://bds123.vn/mat-bang-cho-thue-gan-benh-vien-mat-binh-dinh-pr756368.html
 1.700 m,"Địa chỉ: Đường Hai Bà Trưng, Phường Bến Nghé, Quận 1, Hồ Chí Minh",,,754371,"Thứ bảy, 13:50 02/12/2023","KHÁCH SẠN 65 PHÒNG MỚI ĐẸP - CÁC PHÒNG ĐỀU CÓ CỬA SỔ THOÁNG MÁT LẤY GIẾNG TRỜI TỰ NHIÊN,VỊ TRÍ: NGAY GẦN NHÀ HÁT THÀNH PHỐ( THUỘC KHU PHỐ NHẬT BẢN ), P BẾN NGHÉ, Q1,DT: 9X25,HIỆN TRẠNG: 1 HẦM + 11 TẦNG,SỐ PHÒNG: 65 PHÒNG ( CÁC PHÒNG ĐỀU CÓ CỬA SỔ ),KHÁCH SẠN ĐƯỢC BẢO TRÌ ĐỊNH KÌ HÀNG NĂM,CÓ GP PCCC MỚI NHẤT,KHÁCH SẠN CHUẨN 3 SAO,GIÁ: 900TR/TH,--------,LH: NGUYỄN HUY REALTOR - 0917915189,--------,GIÁ KHÁCH SẠN ĐANG TỐT NHẤT QUẬN 1,VỊ TRÍ ĐẸP - KHU VỰC CHUYÊN KINH DOANH LƯU TRÚ CAO CẤP CÓ TIẾNG Ở QUẬN 1",,https://bds123.cdn.static123.com/images/thumbs/900x600/fit/2023/11/17/189176132_1700203555.jpg,Nguyễn Huy, 0917915189," 900 ,triệu/tháng",Tin thường, Khách sạn mới 65 phòng. Sau lưng nhà hát thành phố. Ngang 9M. 1 Hầm + 12 Tầng. 900TR/TH ,1,https://bds123.vn/khach-san-moi-65-phong-sau-lung-nha-hat-thanh-pho-ngang-9m-1-ham-12-tang-900tr-th-pr754371.html
 33 m,"Địa chỉ: The Sun Avenue - 28 Đường Mai Chí Thọ, Phường An Phú, Quận 2, Hồ Chí Minh", 1 wc , 1 pn ,758811,"Thứ bảy, 13:33 25/11/2023","CỰC RẺ! CHO THUÊ căn hộ THE SUN AVENUE 33m2 full nt có làm lửng chỉ 11tr,- Diện tích: 33m2,- Kết cấu: 1 phòng ngủ và 1 phòng tắm,- Căn hộ được thiết kế theo phong cách hiện đại và cực sang trọng, không gian thoáng mát nhưng vẫn mang lại sự ấm áp.,- Nội thất được bàn giao ĐẦY ĐỦ và đẹp,- Khu vực xung quanh có nhiều tiện ích,- Giá: 11tr ,The Sun avenue sở hữu vị trí cực kỳ đắt địa khi nằm trãi dài trên mặt tiền đại lộ Mai Chí Thọ hơn 500m, trục đường huyết mạch kết nối trực tiếp phía Đông và Tây của thành phố, mặc khác còn thừa hưởng được những lợi thế to lớn khi nằm ngay sát khu trung tâm kinh tế, tài chính mới Thủ Thiêm, nơi tập trung các công trình đô thị tầm cỡ quốc tế cùng với cơ sở hạ tầng được quy hoạch một cách bài bản, mang đến giá trị gia tăng mạnh mẽ trong tương lai.,Cảm ơn anh/chị đã quan tâm đến tin đăng!,Để được tư vấn trực tiếp và biết thêm thông tin, anh/chị vui lòng liên hệ em (Mr) Thịnh (gọi trực tiếp hoặc liên hệ qua zalo) 0986333116 hoặc 0767225559",,https://bds123.cdn.static123.com/images/thumbs/900x600/fit/2023/11/25/e9d486eb-3cc5-4d3c-a85d-63c23415d790_1700889009.jpg,NGUYỄN QUỐC THỊNH, 0986333116," 11 ,triệu/tháng", The Sun Avenue , Cực rẻ! Cho thuê căn hộ The Sun Avenue 33m2 full nt có làm lửng chỉ 11tr ,1,https://bds123.vn/cuc-re-cho-thue-can-ho-the-sun-avenue-33m2-full-nt-co-lam-lung-chi-11tr-pr758811.html
 110 m,"Địa chỉ: Sunrise Riverside - Đường Nguyễn Hữu Thọ, Xã Phước Kiển, Huyện Nhà Bè, Hồ Chí Minh", 2 wc , 3 pn ,748088,"Thứ hai, 14:00 06/11/2023","CHO THUÊ Căn hộ chung cư Sunrise Riverside:,- Diện tích: 110m2, 3PN, 2WC,- Full nội thất full gỗ siêu cao cấp: tv, tủ lạnh, máy lạnh, giường, nệm, bếp, bàn ăn, sofa,....,- Giá 20tr/tháng,- Nhà mới, sạch sẽ, thoát mát, rộng rãi,*Không chỉ sở hữu căn hộ siêu đẹp, quý khách còn sở hữu cả hệ thống tiện ích đẳng cấp: ,Tiện ích nội khu:,+ Hồ bơi tràn, phòng gym.,+ Công viên nội khu, sân bóng, khu vui chơi trẻ em.,+ Nướng BBQ ngoài trời.,+ Café, trà sữa, cửa hàng tiện lợi, siêu thị, nhà hàng ăn uống, trung tâm thương mại,..,+ Bãi giữ xe rộng, chống ngập,Tiện ích ngoại khu:,+ Đặc biệt với vị trí tiếp giáp mặt tiền đường lớn, ngay trung tâm thuận tiện đi Q1, Q4, Q10,....,+ Gần Lotte Mart,+ Gần trường quốc tế RMIT và các trường đại học danh tiếng khác,+ Gần các bệnh viện uy tín: FV, Nam Sài Gòn...,+ Gần Trung tâm Hội chợ & triển lãm Sài Gòn SECC,+ Gần các khu vui chơi, ăn uống sầm uất,* Cập nhật căn hộ giá rẻ khu vực quận 7, Nhà Bè:,SUNRISE RIVERSIDE:,Căn hộ 2PN: 15 - 17 triệu/tháng. (70 - 90 m²).,Căn hộ 3PN: 18-20 triệu/tháng. (85-100 m²).,SUNRISE CITY:,Căn hộ 2PN: 17 - 20 triệu/tháng. (70 - 90 m²).,Căn hộ 3PN: 26 - 28 triệu/tháng. (120 - 150 m²).,Tại DU NHIÊN có cho thuê tất cả các loại hình căn hộ khu vực quận 7, Nhà Bè, giá siêu tốt, siêu ưu đãi cho khách hàng khi kí hợp đồng.,Nhanh tay liên hệ ngay 098.3839.578 ( Call/Zalo/WhatsApp) hoặc Fanpage https://www.facebook.com/TaphoaHomes để sở hữu ngay căn hộ đẹp với giá tốt !!!",,https://bds123.cdn.static123.com/images/thumbs/900x600/fit/2023/11/06/1_1699253839.jpg,Du Nhiên Du Nhiên, 0983839578," 20 ,triệu/tháng", Sunrise Riverside ," Cho thuê căn hộ chung cư Sunrise Riverside Q7, 3PN, full nội thất, LH: 0983839578. ",1,https://bds123.vn/cho-thue-can-ho-chung-cu-sunrise-riverside-q7-3pn-full-noi-that-lh-0983839578-pr748088.html
 35 m,"Địa chỉ: 26/42 Đường Tân Sơn Nhì, Phường Tân Sơn Nhì, Tân Phú, Hồ Chí Minh",,,656384,"Thứ năm, 13:30 30/11/2023","+ Căn hộ mini tọa lạc tại mặt tiền Trường Chinh, Quận Tân Phú, được thiết kế tinh tế và cung cấp đa dạng tiện ích, đáp ứng mọi nhu cầu của khách thuê, tại vị trí trung tâm thành phố.,+ Diện tích: 35m2, nội thất bao gồm 1 phòng ngủ, 1 phòng khách, trang bị máy lạnh, giường, tủ áo, kệ bếp đá hoa cương, gương, bồn rửa chén và WC rộng đẹp. Cảnh quan ban công mặt tiền Trường Chinh tạo nên không gian sống thú vị.,- Dễ dàng di chuyển lên tận 5 lầu thông qua thang máy, chỉ với một nút bấm, mang đến cho bạn cảnh quan toàn cảnh thành phố từ ban công.,- Các tiện ích bao gồm dịch vụ giặt máy, dọn vệ sinh hành lang hàng tuần, kết nối internet cáp quang và truyền hình cáp. An ninh được đảm bảo 24/24 với nhân viên bảo vệ, giờ giấc tự do để bạn cảm thấy thoải mái và yên tâm như ở nhà.,- Đây là sự lựa chọn lý tưởng cho gia đình, nhân viên văn phòng, sinh viên và nhiều đối tượng khác.,Giá thuê rất hợp lý chỉ: 3.9 triệu/tháng.,+ Vị trí thuận tiện gần chợ Võ Thành Trang (Bà Quẹo), siêu thị PANDORA City, ETOWN Cộng hòa, Bệnh viện Mỹ Đức và nhiều trường đại học. Giao thông thuận tiện từ mũi tàu Trường Chinh để di chuyển đến các địa điểm khác trong thành phố.,+ Địa chỉ: Mặt tiền Trường Chinh, Phường Tân Sơn Nhì, Quận Tân Phú (Sau: 26/42 Tân Sơn Nhì, Quận Tân Phú).,Liên hệ: 0937.554.570 (A.Hoàng - Chính Chủ).",,https://bds123.cdn.static123.com/images/thumbs/900x600/fit/2023/05/20/e7fcb05a7155850bdc44_1684582779.jpg,Hoang Le, 0937554570," 3.9 ,triệu/tháng",Tin thường," Phòng căn hộ 1PN, PK 26/42 Tân Sơn Nhì, Q.Tân Phú (DT: 35m2 – View ban công) ",1,https://bds123.vn/phong-can-ho-1pn-pk-26-42-tan-son-nhi-qtan-phu-dt-40m2-view-ban-cong-pr656384.html
 20 m,"Địa chỉ: 12/42 Đường Nguyễn Tuân, Phường 3, Gò Vấp, Hồ Chí Minh",,,689423,"Thứ tư, 13:16 29/11/2023","Cho thuê phòng trọ ( 3mx4m và gác lửng 2,5mx3m ) giá 2,7tr cho 2 người , có 3 cửa sổ ( 2 cửa sổ nhìn ra trời , 1 cửa sổ nhìn ra hành lang, thêm 1 người/300k , toàn bộ bóng đèn led tiết kiệm điện , bóng đèn và van nước hư thay free , wifi và cáp free, có camera quan sát , gác lửng , kệ bếp, sàn rửa chén, , nhà vệ sinh , có bộ lọc nước sạch để nấu ăn . giờ giấc tự do.{ cam kết 2 năm ko len gia . mỗi tháng chi tinh tiền phòng + điện + nuớc . còn tất cả miễn phí }",,https://bds123.cdn.static123.com/images/thumbs/900x600/fit/2023/11/03/img20210602073604_1698975279.jpg,hen xui thoi, 0983078969," 2.7 ,triệu/tháng",Tin thường," Cho thuê Phòng trọ gần trường dhcn 4 , gần bệnh viện 175 ",1,https://bds123.vn/cho-thue-phong-tro-gan-truong-dhcn-4-gan-benh-vien-175-pr689423.html
 50 m,"Địa chỉ: Đường Hoàng Văn Thái, Phường Khương Trung, Thanh Xuân, Hà Nội",, 6 pn ,751079,"Thứ hai, 13:03 11/12/2023","Nhà 3,5 tầng. Diện tích 50m2. Hai mặt thoáng. 6 phòng, 1 sân phơi, 1 gara oto, 1 bếp.,Thuận tiện làm văn phòng, nhà ở.,Ngõ rộng oto tránh nhau,Liên hệ: 0373 159 781",,,Chủ nhà, 0373159781, Thỏa thuận,Tin miễn phí, Cho thuê nhà khu vực phố Hoàng Văn Thái – Thanh Xuân ,1,https://bds123.vn/cho-thue-nha-khu-vuc-pho-hoang-van-thai-thanh-xuan-pr751079.html
