acreage,address,bathroom,bedroom,code,date,description,direction,link_image,name_contact,phone_contact,price,project,title,type,url_page
 40 m,"Địa chỉ: Đường Nguyễn Thái Bình, Phường Nguyễn Thái Bình, Quận 1, Hồ Chí Minh",,,748910,"Thứ năm, 16:49 07/12/2023","Cho thuê căn hộ full nội thất Nguyễn Thái Bình Quận 1, Gần ngay ĐH Văn Lang, ĐH SG, PDB Bùi Viện, Gần PĐB Bùi Viện, ĐH KHTN, ĐHSG, Chợ đêm Hồ Thị Kỷ, thuận tiện di chuyển sang quận 4, quận 5, quận 3, khu trung tâm, phố đi bộ Nguyễn Huệ, Phòng Full nội thất: máy lạnh, tủ lạnh, kệ bếp, bàn ghế, tủ đồ, giường,…, Tiện ích xung quanh: gần chợ, Coop mart, gần cửa hàng tiện lợi, nhiều quán ăn nhà hàng,..., Ban công và Cửa sổ lớn, thoáng mát và sạch sẽ, Camera 24/24, an ninh cao,⏰ Giờ giấc tự do, ra vào bằng vân tay,Liên hệ Khang 0945395185 để được tư vấn trực tiếp .",,,Nguyễn Trọng Khang, 0945395185," 7 ,triệu/tháng",Tin thường, Cho thuê căn hộ full nội thất Nguyễn Thái Bình Quận 1 ,1,https://bds123.vn/cho-thue-can-ho-full-noi-that-nguyen-thai-binh-quan-1-pr748910.html
 96 m,"Địa chỉ: The Sun Avenue - 28 Đường Mai Chí Thọ, Phường An Phú, Quận 2, Hồ Chí Minh", 2 wc , 3 pn ,758958,"Thứ bảy, 16:45 25/11/2023","VIEW TP! CHO THUÊ căn hộ The Sun Avenue 96m2 full nt 21.4tr nhà đẹp,- Diện tích: 96m2,- Kết cấu: 3 phòng ngủ và 2 phòng tắm,- Căn hộ được thiết kế theo phong cách hiện đại và cực sang trọng, không gian thoáng mát nhưng vẫn mang lại sự ấm áp.,- Nội thất được bàn giao ĐẦY ĐỦ và đẹp,- Khu vực xung quanh có nhiều tiện ích,-Tận hưởng view thành phố thơ mộng,- Giá: 21.4tr ,The Sun Avenue có vị trí tọa lạc đắc địa khi nằm trải dài trên mặt tiền đại lộ Mai Chí Thọ tới hơn 500m. Đây là trục đường huyết mạch giúp kết nối trực tiếp giữa khu Đông và Tây của thành phố,Cảm ơn anh/chị đã quan tâm đến tin đăng!,Để được tư vấn trực tiếp và biết thêm thông tin, anh/chị vui lòng liên hệ em (Mr) Thịnh (gọi trực tiếp hoặc liên hệ qua zalo) 0986333116 hoặc 0767225559",,https://bds123.cdn.static123.com/images/thumbs/900x600/fit/2023/11/25/z4869908798369-0c6f4d0c48f86fac3680bc9fe58cf373_1700905099.jpg,NGUYỄN QUỐC THỊNH, 0986333116," 21.4 ,triệu/tháng", The Sun Avenue , View TP! Cho thuê căn hộ The Sun Avenue 96m2 full nt 21.4 triệu nhà đẹp ,1,https://bds123.vn/view-tp-cho-thue-can-ho-the-sun-avenue-96m2-full-nt-214tr-nha-dep-pr758958.html
 77 m,"Địa chỉ: Phường An Lợi Đông, Quận 2, Hồ Chí Minh",,,759717,"Thứ bảy, 16:41 02/12/2023","Cho thuê tầng trệt Shophouse Sarimi mặt tiền đường D9 - View công viên - diện tích rộng đẹp tại Sala Đại Quang Minh Quận 2.,Liên hệ ngay: 0938 781 291. Em Tuân (Niêm nở, chân thành, uy tín).,- Diện tích: 7x11m, tổng diện tích sử dụng 77 m².,- Vị trí: Cực đắc địa, mặt tiền đường D9 siêu đẹp, làn đường rộng, view công viên Sala xanh mát trên khu đô thị SALA Đại Quang Minh.,- Tiện ích: Gần trường học quốc tế Việt ÚC, Emark, Xung quanh có nhiều công ty văn phòng, đầy đủ loại hình kinh doanh, trung tâm thương mại và giải trí chung với đầy đủ các tiện ích cao cấp.,- Thích hợp: Cho mọi loại hình kinh doanh, làm showrom, cty, văn phòng, quán cafe...,- Gía chỉ: 45 triệu /tháng .,Gọi ngay hotline/Zalo: 0938 781 291. Em Tuân - Phục vụ tận tình 24/7.,Cảm ơn quý anh chj đã đọc tin.!",,https://bds123.cdn.static123.com/images/thumbs/900x600/fit/2023/11/27/z4919206815828-f4661b38a78300e540ad357fb29f71b0-result-result_1701076117.jpg,Mai Phạm Tuân, 0938781291," 45 ,triệu/tháng",Tin thường, Mặt bằng kinh doanh tầng trệt Shophouse Sarimi Sala phù hợp tất cả mọi loại hình kinh doanh ,1,https://bds123.vn/mat-bang-kinh-doanh-tang-tret-shophouse-sarimi-sala-phu-hop-tat-ca-moi-loai-hinh-kinh-doanh-pr759717.html
 82 m,"Địa chỉ: Vinhomes Gardenia - Đường Hàm Nghi, Thị trấn Cầu Diễn, Quận Nam Từ Liêm, Hà Nội", 2 wc , 2 pn ,759256,"Chủ nhật, 16:49 26/11/2023","(Chung Cư Vinhomes Gardenia Hàm Nghi ) Cho Thuê Căn 2 Ngủ Full Nội Thất Cao Cấp ,Em Xin chào toàn thể quý anh chị khách thuê? em xin phép Thông tin về căn hộ chung cư Vinhomes gardenia Hàm nghi như sau: ,1. Loại căn hộ : căn hộ 2 phòng ngủ thuộc tòa A1 chung cư Vinhomes gardenia Hàm nghi. ,2. Nội thất : hiện đã được trang bị đầy đủ nội thất bao gồm Thiết bị vệ sinh, thiết bị chiếu sáng,thiết bị điện tử, Bình nóng lạnh,tủ giầy,điều hòa, bếp, tủ bếp, kệ ti vi, tủ quần áo, rèm, giường,đệm,bàn ăn... ,3. Diện tích: 82 mét vuông. ,4. giá thuê đề nghị : 18 triệu đồng -> tính riêng , điện, nước, internet, phí quản lý… (có thể thỏa thuận về giá cả). ,5. Tình trạng chuyển vào ở : có thể chuyển vào luôn. ,6. Phương thức thanh toán: Đặt cọc 1 tháng và trả tiền thuê nhà 6 tháng. ,anh chị tham khảo thông tin và anh chị có nhu cầu tham quan trực tiếp căn hộ liên hệ em theo sđt/zalo : O964.233.224 ,Ưu điểm của căn hộ chung cư Vinhomes gardenia Hàm nghi là: ,1. Vị trí đẹp: chung cư Vinhomes gardenia Hàm nghi nằm sát các trường đại học và trường quốc tế nên người dân hoàn toàn yên tâm với con em.Có quảng trường rộng nên có thể thưởng thức phong cảnh đẹp. Cảnh quan thiên nhiên này mang lại sự thanh thản và thư giãn cho người dân. ,2. Cơ sở vật chất thuận tiện: chung cư Vinhomes gardenia Hàm nghi mang lại sự tiện nghi cho cuộc sống vì cơ sở vật chất gần gũi. Cửa hàng, K-Mart, nhà hàng Hàn Quốc, quán ăn, quán cà phê, bệnh viện nằm xung quanh nên có thể dễ dàng nhận được khi cần thiết. ,3. Môi trường sống cao cấp: chung cư Vinhomes gardenia Hàm nghi cung cấp môi trường sống sang trọng và an toàn. Là khu chung cư với hệ thống bảo mật và cơ sở vật chất hiện đại, đảm bảo an toàn và thoải mái cho người dân. ,4. Không gian sống thoải mái: đơn vị cư trú của chung cư Vinhomes gardenia Hàm nghi được thiết kế rộng rãi, hiện đại. Được cung cấp nội thất và cơ sở vật chất hiện đại cho cuộc sống thoải mái, người dân có thể tận hưởng cuộc sống trong môi trường thoải mái. ,5. Cơ sở vật chất và dịch vụ đa dạng: chung cư Vinhomes gardenia Hàm nghi cung cấp nhiều cơ sở và dịch vụ khác nhau như hồ bơi ngoài trời, trung tâm thể hình, công viên… cho cư dân thưởng thức. Điều này cung cấp cơ hội để có thể tận hưởng các hoạt động giải trí và sinh hoạt lành mạnh. ,6. Khả năng tiếp cận giao thông: chung cư Vinhomes gardenia Hàm nghi nằm trong khu vực thuận tiện cho việc đi lại, ra ngoài. Phương tiện giao thông công cộng phát triển tốt, dễ tiếp cận với các tuyến đường chính, thuận tiện di chuyển. ,Những ưu điểm này làm cho chung cư Vinhomes gardenia Hàm nghi trở thành nơi cư trú hấp dẫn, mang lại cuộc sống thoải mái và sung túc cho người dân.",,https://bds123.cdn.static123.com/images/thumbs/900x600/fit/2023/11/26/stt2_1700991102.jpg,Đỗ minh thiện, 0964233224," 18 ,triệu/tháng", Vinhomes Gardenia , (Chung Cư Vinhomes Gardenia Hàm Nghi ) Cho Thuê Căn 2 Ngủ Full Nội Thất Cao Cấp ,1,https://bds123.vn/chung-cu-vinhomes-gardenia-ham-nghi-cho-thue-can-2-ngu-full-noi-that-cao-cap-pr759256.html
 100 m,"Địa chỉ: Đường Trần Quốc Toản, Phường 8, Quận 3, Hồ Chí Minh", 3 wc , 3 pn ,759740,"Thứ tư, 16:57 27/12/2023","Chính chủ NNC trống cho sữa cho KD - HXH Võ Thị Sáu, Nam kỳ Khởi Nghĩa, Lý Chính Thắng, BV y học quận3,CHO KINH DOANH THOẢI MÁI,HẺM XE HƠI 8M,1 trệt 3 lầu 2pn 3wc,Dài 5 ngang 5", Tây Bắc ,https://bds123.cdn.static123.com/images/thumbs/900x600/fit/2023/11/27/66c002e44f83e6ddbf9239_1701078544.jpg,Mo House, 0905069214," 12 ,triệu/tháng",Tin miễn phí," Chính chủ NNC trống cho sữa cho KD - HXH Võ Thị Sáu, Nam Kỳ Khởi Nghĩa, Lý Chính Thắng BV y học Q3 ",1,https://bds123.vn/chinh-chu-nnc-trong-cho-sua-cho-kd-hxh-vo-thi-sau-nam-ky-khoi-nghia-ly-chinh-thang-bv-y-hoc-q3-pr759740.html
 51 m,"Địa chỉ: The Sun Avenue - 28 Đường Mai Chí Thọ, Phường An Phú, Quận 2, Hồ Chí Minh", 1 wc , 1 pn ,758962,"Thứ bảy, 16:47 25/11/2023","CHỈ 12.5TR sở hữu ngay căn hộ The Sun Avenue 51m2 full nt nhà đẹp,- Diện tích: 51m2,- Kết cấu: 1 phòng ngủ và 1 phòng tắm,- Căn hộ được thiết kế theo phong cách hiện đại và cực sang trọng, không gian thoáng mát nhưng vẫn mang lại sự ấm áp.,- Nội thất được bàn giao ĐẦY ĐỦ và đẹp,- Khu vực xung quanh có nhiều tiện ích,- Giá: 12.5tr ,Dự án The Sun Avenue tọa lạc ngay mặt tiền đại lộ Mai Chí Thọ, tâm điểm của các tuyến đường huyết mạch: Cao tốc Long Thành – Dầu Giây, Metro Bến Thành – Suối Tiên, tuyến đường vành đai trong kết nối trực tiếp với hầm Thủ Thiêm để đến trung tâm quận 1.,Cảm ơn anh/chị đã quan tâm đến tin đăng!,Để được tư vấn trực tiếp và biết thêm thông tin, anh/chị vui lòng liên hệ em (Mr) Thịnh (gọi trực tiếp hoặc liên hệ qua zalo) 0986333116 hoặc 0767225559",,https://bds123.cdn.static123.com/images/thumbs/900x600/fit/2023/11/25/z4869912531452-6bebe29b46e14f76a448603603102449_1700905279.jpg,NGUYỄN QUỐC THỊNH, 0986333116," 12.5 ,triệu/tháng", The Sun Avenue , CHỈ 12.5TR sở hữu ngay căn hộ The Sun Avenue 51m2 full nt nhà đẹp ,1,https://bds123.vn/chi-125tr-so-huu-ngay-can-ho-the-sun-avenue-51m2-full-nt-nha-dep-pr758962.html
 71 m,"Địa chỉ: Sky Garden 3 - Đường Nguyễn Đổng Chi, Phường Tân Phong, Quận 7, Hồ Chí Minh", 1 wc , 2 pn ,759707,"Thứ hai, 16:40 27/11/2023","Cho thuê nhiều căn hộ tại dự án chung cư Sky Garden 3, Phạm Văn Nghị, Quận 7.,Khu dân cư nằm trung tâm Phú Mỹ Hưng, kế bên TTTM Vivo City, gần các trường quốc tế Hoàng Gia, Nam Sài Gòn, Đinh Thiện Lý,...,* Thông tin cơ bản:,- Diện tích: 56m² - 71m². 2PN + 1WC; 1PN + 1WC giá chỉ từ: 10 triệu/tháng.,- Diện tích: 72m² - 81m². 2PN + 2WC nhà đẹp view công viên giá 12 triệu - 15 triệu/tháng.,- Diện tích: 89m² - 91m². 3PN + 2WC nhà đẹp nội thất mới 13 triệu - 17 triệu/tháng.,- Penhouse 1 trệt + 1 lầu + sân thượng: 200m² - 400m² giá từ 25 triệu - 40 triệu/tháng.,* Chung cư Sky Garden kế bên TTTM Vivo City:,- Tiện ích nội khu đầy đủ: Hồ bơi, phòng gym, nhà hàng, siêu thị 24h, tiệm thuốc, spa...,- Khuôn viên cực rộng rãi thoáng mát. Sảnh đi bộ lầu 2 cực dài và đẹp.,- An ninh an toàn đảm bảo.,- Vị trí gần các trường Quốc tế Hoàng Gia, Đinh Thiện Lý, Võ Thị Sáu.,- Gần Đại học RMIT; gần trường Rmit quận 7; đại học quốc tế Rmit cách 5p đi xe, vào trung tâm thành phố 10p đi xe.,- Cam kết có những căn đẹp giá tốt nhất, có đầy đủ hoặc ít nội thất tuỳ theo nhu cầu của khách hàng.,* Giá cho thuê căn rẻ nhất thị trường: 10 triệu/tháng.,Khách hàng có nhu cầu thuê xin liên hệ 0903 668 695 em Giang. Em cảm ơn ạ.",,https://bds123.cdn.static123.com/images/thumbs/900x600/fit/2023/11/27/zzz222_1701075291.jpg,Giang Lê, 0903668695," 10 ,triệu/tháng", Sky Garden 3 ," Cho thuê chung cư Sky Garden 3, PMH, Q7. Nhà đẹp giá tốt nhất thị trường. LH 0903 668 695 Ms Giang ",1,https://bds123.vn/cho-thue-chung-cu-sky-garden-3-pmh-q7-nha-dep-gia-tot-nhat-thi-truong-lh-0903-668-695-ms-giang-pr759707.html
 75 m,"Địa chỉ: Vinhomes Smart City - Đường Đại Mỗ, Xã Đại Mỗ, Quận Nam Từ Liêm, Hà Nội", 2 wc , 3 pn ,734694,"Thứ hai, 16:58 27/11/2023","Cần cho thuê nhanh căn hộ 3 phòng ngủ 2 nhà vệ sinh tòa S202 Vinhomes Smart City,Diện tích : 75m2,Nội thất : đồ cơ bản : Tủ bếp , nóng lạnh, điều hòa, rèm, đệm.,Tầng trung, ban công Đông Nam vào được luôn., Giá cho thuê ưu đãi : 11 triệu /tháng.,Liên hệ xem nhà : 0986.687.645",,https://bds123.cdn.static123.com/images/thumbs/900x600/fit/2023/11/27/3238b10531b8c4e69da911-1696824339_1701080284.jpg,Quách Ngân, 0986687645," 11 ,triệu/tháng", Vinhomes Smart City , Duy nhất căn 3PN2WC 75m đồ cơ bản có bếp vào luôn 11tr/tháng Vinhomes Smart City ,1,https://bds123.vn/duy-nhat-can-3pn2wc-75m-do-co-ban-co-bep-vao-luon-11tr-thang-vinhomes-smart-city-pr734694.html
 96 m,"Địa chỉ: The Sun Avenue - 28 Đường Mai Chí Thọ, Phường An Phú, Quận 2, Hồ Chí Minh", 2 wc , 3 pn ,758961,"Thứ bảy, 16:46 25/11/2023","NHÀ ĐẸP GIÁ RẺ! CHO THUÊ căn hộ The Sun Avenue 96m2 full nt 18tr,- Diện tích: 96m2,- Kết cấu: 3 phòng ngủ và 2 phòng tắm,- Căn hộ được thiết kế theo phong cách hiện đại và cực sang trọng, không gian thoáng mát nhưng vẫn mang lại sự ấm áp.,- Nội thất được bàn giao ĐẦY ĐỦ và đẹp,- Khu vực xung quanh có nhiều tiện ích,-Tận hưởng view thành phố thơ mộng,- Giá: 18tr,Cùng với đó, dự án còn được thừa hưởng những lợi thế hấp dẫn khi nằm ngay sát cạnh khu trung tâm tài chính, kinh tế mới Thủ Thiêm. Nơi đây tập trung hàng loạt các công trình đô thị tầm cỡ quốc tế cùng với cơ sở hạ tầng đã được quy hoạch bài bản, đem lại giá trị gia tăng mạnh mẽ trong tương lai.,Cảm ơn anh/chị đã quan tâm đến tin đăng!,Để được tư vấn trực tiếp và biết thêm thông tin, anh/chị vui lòng liên hệ em (Mr) Thịnh (gọi trực tiếp hoặc liên hệ qua zalo) 0986333116 hoặc 0767225559",,https://bds123.cdn.static123.com/images/thumbs/900x600/fit/2023/11/25/z4869911127271-331cd98fb9be1afba248a40c8754f4fc_1700905176.jpg,NGUYỄN QUỐC THỊNH, 0986333116," 18 ,triệu/tháng", The Sun Avenue , Nhà đẹp giá rẻ! Cho thuê căn hộ The Sun Avenue 96m2 full nt 18tr ,1,https://bds123.vn/nha-dep-gia-re-cho-thue-can-ho-the-sun-avenue-96m2-full-nt-18tr-pr758961.html
 360 m,"Địa chỉ: Đường Vành Đai 3, Phường Trần Phú, Hoàng Mai, Hà Nội",,,757707,"Thứ bảy, 17:02 23/12/2023","- Diện tích: 360 m2,- Địa điểm văn phòng nằm trong Khu đô thị, thuận tiện đi lại, ngay cạnh các cửa hàng ăn uống, dịch vụ tiện nghi, cây xăng,...,- Có chỗ để xe máy, ô tô rộng rãi",,,Nguyễn Khánh Linh, 0967683374, Thỏa thuận,Tin thường, Chính chủ cho thuê Văn phòng làm việc ,1,https://bds123.vn/chinh-chu-cho-thue-van-phong-lam-viec-pr757707.html
 117 m,"Địa chỉ: Đảo Kim Cương - Diamond Island - Phường Bình Trưng Tây, Quận 2, Hồ Chí Minh, Việt Nam",, 4 pn ,747302,"Thứ bảy, 17:04 04/11/2023","• Diện tích : 177m2,• Diện tích sân vườn : 56m2,• Thiết kế 4 phòng ngủ,• Giá thuê : 3100$/ tháng,• Ban công trồng cây, trang trí cảnh quan thoải mái,• Vị trí: Maldives,Liên hệ: 0762382644 - Thủy Chuyên chuyển nhượng và cho thuê dự án Diamond Island", Tây Nam ,https://bds123.cdn.static123.com/images/thumbs/900x600/fit/2023/11/04/379251343-3564810710459652-5248482358302788490-n_1699091605.jpg,Lê Thủy, 0589455864," 76 ,triệu/tháng", Đảo Kim Cương - Diamond Island , Đừng bỏ qua tin này nếu bạn muốn thuê căn hộ 4 PN tại Diamond Island ,1,https://bds123.vn/dung-bo-qua-tin-nay-neu-ban-dang-muon-thue-can-ho-4-pn-tai-diamond-island-pr747302.html
 25 m,"Địa chỉ: 8B Đường Nguyễn Văn Thủ, Phường Đa Kao, Quận 1, Hồ Chí Minh",,,757125,"Thứ sáu, 17:01 22/12/2023","giá 5tr5,điện 4k,nước 100k/1n,1 Tủ Lạnh,1 Máy Giặt,1 Máy Lạnh,1 Tủ bếp và bếp điện,1 Tủ quần áo + Giường Gỗ bàn làm việc,niệm mới và drap giường",,https://bds123.cdn.static123.com/images/thumbs/900x600/fit/2023/11/22/z4904921528979-44a55a54543b6b71eaf14f4f57597861_1700646824.jpg,Duy Thái, 0902678402," 5.5 ,triệu/tháng",Tin miễn phí, Cho thuê Phòng trung tâm Q1 đầy đủ tiện nghi ,1,https://bds123.vn/cho-thue-phong-trung-tam-q1-day-du-tien-nghi-pr757125.html
 73 m,"Địa chỉ: The Park Residence - Đường Nguyễn Hữu Thọ, Xã Phước Kiển, Nhà Bè, Hồ Chí Minh", 2 wc , 2 pn ,750096,"Thứ năm, 16:11 09/11/2023","Cho thuê căn hộ 2PN 2WC tại The Park Residence.,Giá cho thuê nhanh 10 triệu/tháng.,Tiện ích: Siêu thị Genhai, 7eleven, GS25, gym, hồ bơi 2000m tràn bờ, trường mẫu giáo, sân tennis...,Cách trường ĐH Tôn Đức Thắng chỉ 10p xe máy chạy thẳng mặt tiền đường Nguyễn Hữu Thọ.,Đ/c: Chung cư The Park Residence 12 Nguyễn Hữu Thọ, Phước Kiển Nhà Bè.,Có chìa khoá căn hộ cụ thể cho khách xem, tham quan đến khi có quyết định thuê.,Công ty chuyên nghiệp - nhiệt tình hỗ trợ khách hàng, chìa khóa trao tay.,Khách hàng được xem hình ảnh, Video căn hộ thực tế mà công ty khác không có.,Liên hệ: 0906896786 em My để được tư vấn và xem nhà thực tế.",,https://bds123.cdn.static123.com/images/thumbs/900x600/fit/2023/11/09/z4863939935300-de0463d18ae467a89634a377b4762712_1699520861.jpg,Nguyễn Thảo My, 0906896786," 10 ,triệu/tháng", The Park Residence , Cho thuê The Park Residence giá rẻ nhất thị trường 10tr/tháng 2PN 2WC 73m2 nhà đẹp nội thất mới cứng ,1,https://bds123.vn/cho-thue-the-park-residence-gia-re-nhat-thi-truong-cty-bds-sinh-thanh-pr750096.html
 100 m,"Địa chỉ: Phố Trung Kính, Phường Yên Hòa, Cầu Giấy, Hà Nội",,,746753,"Chủ nhật, 16:14 03/12/2023","❌CHÍNH CHỦ CHO THUÊ GẤP VĂN PHÒNG MẶT ĐƯỜNG TRUNG KÍNH_CẦU GIẤY❌,Diện tích cho thuê: 50m2, 110m2, 160m2, 220m2,--------------------------------,ƯU ĐÃI:,Đã setup đầy đủ chỗ ngồi bao gồm bàn + ghế thái công học, mới 100%,Có tủ đồ cá nhân, phòng họp riêng, tivi, mới 100%,Free điều hòa âm trần, hệ thống chiếu sáng, hệ thống đường mạng, điện sử dụng làm việc,Miễn phí sử dụng khu Relax ăn uống, lò vi sóng, tủ lạnh, nước uống, tủ giày (~70 m2),Hợp đồng ký linh hoạt:1-6 tháng/lần,-------------------------------,Miễn trung gian. Giá cho thuê chỉ từ 29 triệu. Liên hệ: 0978.684.900 (Zalo) để xem văn phòng.",,https://bds123.cdn.static123.com/images/thumbs/900x600/fit/2023/11/03/khu-lam-viec-2_1699002422.jpg,luong hanh, 0978684900," 29 ,triệu/tháng",Tin miễn phí," Chính chủ cho thuê gấp văn phòng mặt đường Trung Kính, Cầu Giấy. ",1,https://bds123.vn/chinh-chu-cho-thue-gap-van-phong-mat-duong-trung-kinhcau-giay-pr746753.html
 20 m,"Địa chỉ: Đường Nguyễn Du, Phường 7, Gò Vấp, Hồ Chí Minh",,,755329,"Thứ sáu, 16:00 01/12/2023","Phòng mới xây mới 100% sẵn tiện nghi. Phòng có ban công thoáng mát cả ngày, lấy ánh sáng tự nhiên vào phòng tiết kiệm điện, nội thất cao cấp.,Trang bị sẵn các thiết bị:,+ GIƯỜNG, NỆM,+ MÁY LẠNH,+ TỦ QUẦN ÁO,+ KỆ TỦ BẾP NẤU ĂN THOẢI MÁI,+ NƯỚC NÓNG LẠNH (FREE),+ WIFI CÁP QUANG TỐC ĐỘ CAO,+ CAMERA QUAN SÁT 24/24H,+ HỆ THÔNG CỬA TỪ AN TOÀN,Vị trí đường ngay trung tâm Gò Vấp. Thuận tiện di chuyển qua quận Phú Nhuận, Bình Thạnh, Tân Bình, sân bay chỉ 5 phút,...,Xung quanh đầy đủ tiện ích siêu thị 24/24, EMART, VINCOM.,Gần các trường Đại Học Mở, ĐH Công Nghiệp, ĐH Nguyễn Tất Thành, ĐH Văn Lang...,GIỜ GIẤC TỰ DO 24/24 dành cho các bạn đi làm,Địa chỉ:Hẻm 783 Phan Văn Trị F7 Gò Vấp (số cũ),143 Nguyễn Du, F7, Gò Vấp (số mới),Giá: 3.2 - 4.5 triệu,SDT liên hệ: 0901901116",,https://bds123.cdn.static123.com/images/thumbs/900x600/fit/2023/11/19/2_1700380888.png,Mr Lộc, 0935534687," 3.2 ,triệu/tháng",Tin thường," Phòng mới xây, ban công, sẵn nội thất. Ngay VINCOM Phan Văn Trị ",1,https://bds123.vn/phong-moi-xay-ban-cong-san-noi-that-ngay-vincom-phan-van-tri-pr755329.html
 9.2 m,"Địa chỉ: Phường Bình Chuẩn, Thuận An, Bình Dương",,,757649,"Thứ bảy, 16:02 23/12/2023","Diện tích 6.700m2 (chưa tính văn phòng và bếp ăn),Diện tích khuôn viên 9.200m2,Trang bị PCCC vách, điện sản xuất, nước máy,Thời hạn thuê lâu dài từ 5 - 10 năm,Giá thuê 420TR,---,Call/Zalo: 0906 939 081 (Hoàng Anh) để được hỗ trợ tư vấn",,https://bds123.cdn.static123.com/images/thumbs/900x600/fit/2023/11/23/400867616-338954818826220-3282029146986837132-n_1700729430.jpg,Hoàng Anh, 0906939081," 420 ,triệu/tháng",Tin miễn phí," Cho thuê kho xưởng sản xuất tại Thuận An, Bình Dương ",1,https://bds123.vn/cho-thue-kho-xuong-san-xuat-tai-thuan-an-binh-duong-pr757649.html
 73 m,"Địa chỉ: Jamila Khang Điền - Đường Song Hành, Phường Phú Hữu, Quận 9, Hồ Chí Minh", 2 wc , 2 pn ,758442,"Thứ sáu, 16:08 24/11/2023","CĂN HỘ CÓ SÂN VƯỜN TẠI JAMILA KHANG ĐIỀN, FULL NT CAO CẤP CHỈ 12 TRIỆU,✨2PN 2WC, Dt 73m2,✨2 phòng ngủ đều có view,✨Ban công bước ra vườn,✨Hướng đông nam đón gió,✨Full nội thất cao cấp,Giá: 12 triệu,✨Nhận nhà đầu tháng 5,Lh xem nhà và hỗ trợ chọn căn ưng ý: 0942.50.8611 em Thoa, Địa chỉ: đường Song Hành, Phú Hữu, Tp Thủ Đức, Tp HCM - Ngay lối lên cao tốc.- Kề Lakeview City, Global City, PalmHeight, Saigon Sport City.,*** Tiện ích nội khu đầy đủ:,- Gym, yoga, khu vui chơi trẻ em, khu sinh hoạt cộng đồng view trực diện hồ bơi.,- Hồ bơi tràn bờ 858m2.,- hệ thống Shophouse thương mại 2 tầng: Spa, Winmart, Pharmacity, Cà phê, Nhà trẻ.,Phí dịch vụ: 12k/m2 (CBRE). Xe máy: 110k/tháng. Ô tô:600-990k/tháng",,https://bds123.cdn.static123.com/images/thumbs/900x600/fit/2023/11/24/2_1700816373.jpg,Thoa Vo, 0942508611," 12 ,triệu/tháng", Jamila Khang Điền ," Cho thuê căn hộ có sân vườn tại Jamila Khang Điền, Full NT cao cấp chỉ 12 triệu ",1,https://bds123.vn/can-ho-co-san-vuon-tai-jamila-khang-dien-full-nt-cao-cap-chi-12-trieu-2-pr758442.html
 102 m,"Địa chỉ: 47/4 Đường Trần Quốc Toản, Phường 6, Quận 3, Hồ Chí Minh", 2 wc , 2 pn ,758432,"Thứ tư, 16:06 29/11/2023","GIA ĐÌNH CẦN CHO THUÊ DÀI HẠN NHÀ,- Gửi ACE môi giới,- Nhà hướng: Đông Nam, cách Đường Trần Quốc Toản 02 căn nhà, hẻm thông ra Đường Võ thị Sáu và Đường Pasteur.,- Hẻm 2.5m ,- Gần : Chợ Tân định, các Trường học, Công viên Lê văn tám . Rất thuận tiện để ở và kinh doanh online…,- Diện tích sử dụng: 3 x 17m ( tổng cộng 02 sàn 102m2 ),- Kết cấu: 1 trệt + 1 lầu , sân để xe, 1 phòng khách, 1 phòng bếp, 02 phòng ngủ, 2 WC,- Nhận nhà ngay trong ngày,- Liên hệ chính chủ: Chị Hà 0903120165 - 0933992855,( giá 12,5 triệu/1 tháng ),Địa Chỉ: 47/4 TRẦN QUỐC TOẢN, PHƯỜNG VÕ THỊ SÁU, QUẬN 3, TPHCM", Đông Nam ,https://bds123.cdn.static123.com/images/thumbs/900x600/fit/2023/11/24/z4910200315952-40319f39a7b21b71ca57ea5f748e29de_1700816497.jpg,chính chủ, 0773593259," 12.5 ,triệu/tháng",Tin thường, Cho thuê nhà 1 lầu hẻm 47 Trần Quốc Toản Q3 giao nhà vào ở ngay ,1,https://bds123.vn/cho-thue-nha-1-lau-hem-47-tran-quoc-toan-q3-giao-nha-vao-o-ngay-pr758432.html
 59 m,"Địa chỉ: Đường Nguyễn Xiển, Phường Long Thạnh Mỹ, Quận 9, Hồ Chí Minh", 2 wc , 2 pn ,759714,"Thứ bảy, 16:06 02/12/2023","Vinhomes grand Park Quận 9,- Cho thuê căn 2PN 2wc,- Nội thất: Gần full, thiếu 1 giường,- View nội khu mát mẻ, không chắn toà,- Giá thuê: 8 triệu / tháng,- Vào ở được liền,- Không kén khách thuê,Liên hệ: 0374.353.133 em Trang hỗ trợ xem nhà",,https://bds123.cdn.static123.com/images/thumbs/900x600/fit/2023/11/27/a4c0cae1-6f9b-490b-abfe-d8a4ce97ef30_1701075654.jpg,Nguyễn Thị Thu Trang, 0374353133," 8 ,triệu/tháng",Tin thường, Cho thuê căn hộ 2PN 2WC Vinhomes Quận 9 giá chỉ 8 triệu/ tháng ,1,https://bds123.vn/cho-thue-can-ho-2pn-2wc-vinhomes-quan-9-gia-chi-8-trieu-thang-pr759714.html
