acreage,address,bathroom,bedroom,code,date,description,direction,link_image,name_contact,phone_contact,price,project,title,type,url_page
 25 m,"Địa chỉ: 244 Đường CN1, Phường Sơn Kỳ, Tân Phú, Hồ Chí Minh",,,124888,"Thứ hai, 15:17 04/12/2023","- Cho thuê phòng trọ đẹp như hình, đầy đủ nội thất như khách sạn, nhà mới xây được vài tháng, rất mới, sạch đẹp.,- Vị trí gần siêu thị AEON MALL Tân Phú, công viên Sơn Kỳ, gần các đường như: Lê Trọng Tấn, Tân Kỳ Tân Qúy,....,- Đặc điểm:,+ Phòng rất rộng từ 20m2 - 30m2,+ PHÒNG CÓ NỘI THẤT: máy lạnh, tủ áo, bàn ăn cơm, giường, nệm, quạt, tivi, bàn làm việc, tủ lạnh,......như 1 căn hộ mini cho không gian sống lý tưởng.,+ Các phòng đều có cửa sổ thông ra trời mát mẻ cả ngày.,+ Giờ giấc tự do, về lúc nào cũng được.,+ Có hầm để xe, đặt biệt không tính phí xe,+ Không chung chủ,+ Wifi mạnh, lướt net, face thoải mái, Có chổ phơi đồ rộng rãi,+ Hệ thống an ninh hiện đại an toàn, cửa ra vào kiểm soát bằng vân tay, nhà xe có camera chống trộm.,+ Khu vực dân trí cao, đường trước nhà rộng 8m, gần chợ, siêu thị, trung tâm.....,+ Xem phòng đảm bảo thích ngay,------------------------------------,- Hiện có các loại phòng như sau:,+ PHÒNG: 2.5tr/tháng - (rộng 20m2 - chỉ có máy lạnh),+ PHÒNG: 2.7tr - 3 tr/tháng - (rộng 25m2 - đủ nội thất),+ PHÒNG: 3.3tr - 3.5tr/tháng - (rộng 30m2 - đủ nội thất),+ PHÒNG: 2.3tr/tháng - (rộng 20m2 - phòng trống),-----------------------------------------,- LIÊN HỆ: --- 0931.463.484 --- để hẹn xem phòng,- ĐỊA CHỈ: 244 đường số 5, gần AEON MALL Tân Phú, đi đường CN1 vô - (XIN GỌI HẸN TRƯỚC)",,https://bds123.cdn.static123.com/images/thumbs/900x600/fit/2019/03/05/img-0378_1551763120.jpg,Q. lý, 0931463484," 2.6 ,triệu/tháng",Tin thường," Phòng trọ mới xây, đẹp như khách sạn, đầy đủ nội thất, giờ giấc tự do, gần Aeon Mall ",1,https://bds123.vn/phong-tro-moi-xay-dep-nhu-khach-san-day-du-noi-that-gio-giac-tu-do-gan-aeon-mall-pr124888.html
 20 m,"Địa chỉ: 149/b16 Đường Lý Thánh Tông, Tân Phú, Hồ Chí Minh",,,121664,"Thứ hai, 15:00 04/12/2023","- Căn phòng trọ mới xây 100% và rất đẹp để cho thuê. Vị trí của nó rất thuận tiện để đi làm hay học hành qua các quận khác như Tân Phú, Q11, Q10, Q. Tân Bình, Q6, ... nằm giữa các tuyến đường lớn như Hòa Bình, Phan Anh, Tô Hiệu, Thoại Ngọc Hầu, Lũy Bán Bích.,- Mô tả chi tiết về không gian sống lý tưởng như sau:,+ Phòng mới xây 100%, đẹp giống trong hình.,+ Khu dân trí cao, đường vào nhà rộng 8m, xe tải vô tận nơi thoải mái.,+ Phòng thiết kế rộng, đẹp như mơ, có gác lửng rất rộng, đúc bê tông chắc chắn.,+ Có kệ bếp nấu ăn trong mỗi phòng thuận tiện nấu nướng.,+ Cửa sổ đón gió mát mẻ, WC rộng rãi, có bồn rửa mặt, vòi sen, xịt sang trọng và đầy đủ.,+ Giờ giấc thoải mái. Bạn bè đến chơi vô tư.,+ Nhà có chỗ để xe rộng rãi, đặt biệt miễn phí phí để xe.,+ Wifi mạnh: lướt net, face thoải mái. Nhà không chung chủ.,+ Hệ thống an ninh hiện đại đảm bảo an toàn, cửa ra vào kiểm soát bằng hệ thống vân tay, nhà xe có camera an ninh chống trộm.,- Phòng đa dạng về diện tích từ 20m2 - 25m2 - 30m2 - 35m2.,----------------------------------------,- Hiện có các phòng đều có GÁC LỬNG với giá thuê:,+ PHÒNG 2.5 triệu/tháng.,+ PHÒNG 2.7 triệu/tháng - 3.2 triệu/tháng.,+ PHÒNG 3.5 triệu/tháng - (DT 35m2).,+ PHÒNG 3.2 - 3.5 triệu/tháng - (CÓ BAN CÔNG RẤT ĐẸP, DT 25m2 - 30m2).,------------,- LIÊN HỆ SĐT:-- 0965.699.811 - để hẹn xem phòng thoải mái.,- Địa chỉ: 149/B16 Lý Thánh Tông, Quận Tân Phú, TPHCM",,https://bds123.cdn.static123.com/images/thumbs/900x600/fit/2019/01/05/img-6238_1546670473.jpg,Chủ, 0965699811," 2.5 ,triệu/tháng",Tin thường," Cho thuê phòng trọ mới xây 100% gần Đầm Sen, đẹp tuyệt vời, có gác rộng, giờ thoải mái ",1,https://bds123.vn/phong-tro-moi-xay-100-gan-dam-sen-dep-nhu-mo-co-gac-rong-gio-tu-do-pr121664.html
 96 m,"Quận 2, Hồ Chí Minh", 2 wc , 2 pn ,752664,"Thứ tư, 16:43 22/11/2023","Cho thuê Căn hộ 2 phòng ngủ tại Sarina Sala-nhà mới, diện tích rộng , full nội thất cao cấp.,+ Diện tích 96 m2,+ Thiết kế: 2 phòng ngủ, 2 vệ sinh, phòng khách, ban công, sân phơi, bếp.,Giá thuê chỉ: 28 tr/ tháng ( thương lượng ).,+ Khu đô thị mới xanh - trong lành - thoáng đãng đẹp, khu vực thuận tiện di chuyển đến các quận 1, quận 4, Bình Thạnh, Thủ Đức,,+Tiện ích: nội khu Hồ bơi, BBQ, Sân vườn, Sauna, bóng bàn ...,+ Siêu thị Emark, Coffee shop, Nhà Hàng, Công viên 15ha, Lâm viên sinh thái 150ha,------------------------------------,+ Gọi ngay em Tuân Hotline / Zalo: 0938 781 291. Hỗ trợ tư vấn và xem nhà 24/7.,Cảm ơn quý anh chị đã xem tin !",,https://bds123.cdn.static123.com/images/thumbs/900x600/fit/2023/11/14/z4879695882745-f8143fee5458f96cd6d720b0a2922d31_1699954732.jpg,Mai Phạm Tuân, 0938781291," 28 ,triệu/tháng", Sarina Sala , Cho thuê căn hộ 2 phòng ngủ tại Sarina Sala 96 m2 giá chỉ 28 triệu / tháng ,1,https://bds123.vn/cho-thue-can-ho-2-phong-ngu-tai-sarina-sala-96-m2-gia-chi-28-trieu-thang-pr752664.html
 28 m,"Địa chỉ: 72 Đường Nguyễn Văn Yến, Phường Tân Thới Hòa, Tân Phú, Hồ Chí Minh",,,275609,"Thứ hai, 15:18 04/12/2023","- PHÒNG TRỌ CAO CẤP - CĂN HỘ : RẤT ĐẸP NHƯ KHÁCH SẠN 5 SAO, FULL ĐẦY ĐỦ NỘI THẤT CAO CẤP TIỆN NGHI.,- Gần các tuyến đường lớn như: Tô Hiệu, Hòa Bình....vô trung tâm chỉ vài phút.,------- GIÁ ------>,- Các phòng đều có FULL ĐỦ NỘI THẤT CAO CẤP, cửa sổ lớn thông trời mát mẻ :,+ PHÒNG: 2.9tr/tháng,+ PHÒNG: 3.3t - 3.7tr/tháng,+ CĂN LỚN: 3.7tr - 4.2tr/tháng - (rộng 45m2, như căn hộ, có bồn tắm nằm),--------ĐẶC ĐIỂM TIỆN ÍCH------------,+ Các phòng đều thông ra trời mát mẻ cả ngày.,+ Phòng rất rộng từ 30m2 - 45m2,+ PHÒNG CÓ FULL NỘI THẤT CAO CẤP: máy lạnh, giường, nêm, tủ áo, tủ lạnh, quạt, bàn trang điểm, bàn làm việc, kệ bếp nấu ăn, tủ bếp, kệ bếp.......như 1 căn hộ mini cao cấp.,+ GIỜ GIẤC ĐI VỀ TỰ DO,+ CÓ THANG MÁY,+ CÓ NƯỚC NÓNG ĐỂ TẮM,+ CÓ MÁY GIẶT MIỄN PHÍ,+ Không chung chủ, chỉ người thuê ở thôi,+ Wifi mạnh, Chổ phơi đồ rộng,+ Cửa ra vào mở bằng vân tay, nhà xe có camera chống trộm 24/24,+ Đường trước nhà rộng 16m, gần chợ, siêu thị, trung tâm.........,+ Xem phòng đảm bảo thích ngay, không đâu sang trọng bằng.,--------> XEM XIN LIÊN HỆ: --- 0764.764.860 --(GỌI HẸN TRƯỚC),- Địa chỉ: 72 Nguyễn Văn Yến, Q.Tân Phú - ngay đường Tô Hiệu quẹo vô",,https://bds123.cdn.static123.com/images/thumbs/900x600/fit/2021/03/23/5a65a4954f5ec-1516610709_1616480995.jpg,quản lý, 0764764860," 2.9 ,triệu/tháng",Tin thường," Căn hộ mini: Full nội thất cao cấp, đầy đủ tiện nghi, rất đẹp như khách sạn 5 sao. ",1,https://bds123.vn/phong-full-noi-that-cao-cap-day-du-tien-nghi-rat-dep-nhu-khach-san-5-sao-pr275609.html
 50 m,"Địa chỉ: Vinhomes D'Capitale - 119 Đường Trần Duy Hưng, Phường Trung Hòa, Quận Cầu Giấy, Hà Nội", 1 wc , 1 pn ,749428,"Thứ tư, 15:17 08/11/2023","HIẾM - CHO THUÊ CĂN HỘ 1 NGỦ, CÓ THỂ LÀM VĂN PHÒNG, GIÁ 13 TRIỆU TẠI VINHOMES D’CAPITALE THÁNG 11/2023,Chính chủ cần cho thuê: Căn hộ chung cư cao cấp Vinhomes D’capitale tại 119 Trần Duy Hưng,+ Diện tích 50m2, 1 Phòng ngủ, 1 vệ sinh.,+ Hướng Đông Nam, thoáng, view hồ,+ Căn hộ có đồ nội thất cơ bản như: sofa, tủ bếp, máy giặt, điều hòa, đèn...,+ Căn hộ có thể vừa dùng làm văn phòng, hoặc để ở, đều phù hợp.,+ Nhà có đặc điểm: Thang máy cực nhanh, Đi lại thuận tiện và thông thoáng,Tiện ích:,+ Trung tâm Thương mại Vincom sầm uất.,+ Bể bơi ngoài trời, khu tập gym.,+ Khu vui chơi trẻ em sạch sẽ,+ Đối diện trung tâm mua sắm Big C,+ Di chuyển đi sân bay, cũng như vào nội đô thuận lợi.,Giá cho thuê: 13 triệu/tháng _Xem nhà thời gian nào cũng được,Liên hệ: chủ nhà: 093.689.0886 (chị Hoàn)", Đông Nam ,https://bds123.cdn.static123.com/images/thumbs/900x600/fit/2023/11/08/z4859571004293-700d27032f7da684ec82c315ab5aa4b9_1699429865.jpg,Nguyễn Thu Hoàn, 0936890886," 13 ,triệu/tháng", Vinhomes D'Capitale ," Cho thuê căn hộ 1 ngủ, đồ cơ bản, giá 13 triệu tại Vinhomes D'Capitale ",1,https://bds123.vn/cho-thue-can-ho-1-ngu-do-co-ban-gia-13-trieu-tai-vinhomes-dcapitale-pr749428.html
 100 m,"Địa chỉ: Số 8, Phố Tôn Đức Thắng, Phường Khai Quang, Vĩnh Yên, Vĩnh Phúc",,,749450,"Thứ sáu, 15:19 08/12/2023","TÒA NHÀ TÀI CHÍNH VIỆT ĐỨC - CHO THUÊ VĂN PHÒNG, CĂN HỘ,Tọa lạc tại vị trí đẹp nhất tại Thành phố Vĩnh Yên, với hệ thống đội ngũ quản lý chuyên nghiệp sẽ mang tới cho Quý Khách hàng trải nghiệp tuyệt vời nhất!,Với nhiều ưu đãi đặc biệt khi thuê văn phòng, căn hộ tại Tòa nhà Tài chính Việt Đức:, Giá văn phòng thuê chỉ còn 1xx/1m2, Giá thuê căn hộ: Chỉ từ 12.000.000đ/tháng, - Văn phòng sẵn giao ngay với hệ thống cơ bản, - Miễn phí nước sạch,- Miễn phí vệ sinh dọn dẹp chung,- Miễn phí, phí quản lý (đối với dịch vụ cho thuê căn hộ), - Dịch vụ An ninh 24/7,- Diện tích đa dạng từ 50 - 200m2,- Vị trí nằm ngay trung tâm, hội trường, sảnh chính, quầy bar,...,- Không gian xanh, tạo cơ hội kết nối với các doanh nghiệp khác đang sử dụng dịch vụ tại Tòa nhà Tài chính Việt Đức,- Thiết kế hiện đại, tối giản, mang lại cảm giác làm việc hiệu quả nhất, Tòa nhà Tài chính Việt Đức - Đồng hành cùng các cá nhân/doanh nghiệp kiến tạo thành công. Liên hệ ngay với chúng mình để được tư vấn và hỗ trợ đặt chỗ nhanh nhất nhé!, Hãy liên hệ cho chúng tôi để biết thêm thông tin và tận hưởng chất lượng dịch vụ., Địa chỉ: Tòa nhà Tài chính Việt ĐứcSố 8 - Đường Tôn Đức Thắng - Phường Khai Quang - Thành Phố Vĩnh Yên - Tỉnh Vĩnh,Hotline: 0899 833 388 - Ms.Thùy,Rất hân hạnh được phục vụ Quý Khách hàng!",,https://bds123.cdn.static123.com/images/thumbs/900x600/fit/2023/11/08/z4840661697165-d87c25d962fd5869820ba90626a3a30c_1699431019.jpg,Trần Thị Bích Thùy, 0899833388," 130.000 ,đồng/m,/tháng",Tin miễn phí," Cho thuê văn phòng, căn hộ tại thành phố Vĩnh Yên, Vĩnh Phúc ",1,https://bds123.vn/cho-thue-van-phong-can-ho-tai-thanh-pho-vinh-yen-vinh-phuc-pr749450.html
 78 m,"Địa chỉ: Vinhomes Central Park - 208 Đường Nguyễn Hữu Cảnh, Phường 22, Quận Bình Thạnh, Hồ Chí Minh", 2 wc , 2 pn ,758345,"Thứ sáu, 15:16 24/11/2023","Chuyên cho thuê Căn Hộ Vinhomes Landmark 81,Ngắn Hạn ( Ngày - Tuần - Tháng ),Tòa Landmark 1-2-3-4-5-6 và Tòa Landmark Plus:,Giá 1 Phòng Ngủ : ~1triệu2 / đêm,Giá 2 Phòng Ngủ : ~1triệu5 / đêm,Giá 3 Phòng Ngủ : ~2.3triệu / đêm,Giá 4 Phòng Ngủ : Khách liên hệ,Tòa Landmark 81:,Giá 1 Phòng Ngủ : ~1triệu5 / đêm,Giá 2 phòng Ngủ : ~2triệu5 / đêm,Giá 3 Phòng Ngủ : ~3triệu8 / đêm,Giá 4 Phòng Ngủ : Khách liên hệ,Khách Hàng Thuê Tuần Hoặc Tháng Sẽ Có Giá Tốt Hơn,Dài hạn ( - Năm),: 54m2: ~16 - 18 triệu / tháng,: 85m2: ~20 - 25 triệu / tháng,: 116m2: ~30 - 35 triệu / tháng,: 180m2: ~50 - 65 triệu / tháng,* Quý khách lưu ý trên này là giá trung bình có thể thay đổi tùy căn và thời điểm,Giá chuyển nhượng:,Từ 3 tỷ cho căn 1PN OT khu Landmark,Từ 4.5 tỷ cho căn 2PN OT khu Landmark,Giá 3PN, 4PN: Khách liên hệ,Tiện ích nội khu: Trung tâm thương mại Landmark 81 tầng, Công viên Central Park siêu đẹp, Gym, Hồ Bơi, Trường Học, Bệnh Viện, Siêu thị, Quán Bar, Nhà hàng...,Bên Trong Căn hộ: View đẹp, Nội thất mới được vệ sinh sạch sẽ thay chăn ga thường xuyên theo yêu cầu, Có máy giặt (sấy), Bếp dụng cụ nấu ăn đầy đủ: Có bếp từ, Nồi cơm điện, Ấm siêu tốc...,Chỉ mất hơn 5p để di chuyển vào trung tâm Q1 dễ dàng bằng trục đường Nguyễn Hữu Cảnh - Tôn Đức Thắng,Có Hầm gửi Xe máy, Xe oto tại tòa, Sảnh Lễ Tân, An Ninh Bảo Vệ 24/7,Để Đặt Booking 24/7 em Lợi Vinhomes,Địa chỉ: Vinhomes Central Park, 208 Nguyễn Hữu Cảnh, Phường 22, Quận Bình Thạnh, Tp.Hồ Chí Minh.",,https://bds123.cdn.static123.com/images/thumbs/900x600/fit/2023/11/24/z4907996229409-77e1aaa5fceecc34ee24f4fbf393081f_1700811363.jpg,Lợi Vinhomes, 0775252448," 18 ,triệu/tháng", Vinhomes Central Park , Chuyên cho thuê - Chuyển nhượng Vinhomes Landmark 81 đẹp giá tốt nhất thị trường 0901893180 ,1,https://bds123.vn/chuyen-cho-thue-chuyen-nhuong-vinhomes-landmark-81-dep-gia-tot-nhat-thi-truong-0901893180-pr758345.html
 40 m,"Địa chỉ: 195/19/11 Đường Lê Văn Sỹ, Phường 13, Quận 3, Hồ Chí Minh",,,758340,"Chủ nhật, 15:15 24/12/2023",Mini home fun nội thất gồm: máy lạnh. Máy giặc. Tủ lạnh xịn lắm. Kệ bếp. Bếp điện từ đôi. Bàn làm việc. Bàn trang điểm. fun mới chăn gra gối nệm cho bạn đến ở . Nước nóng năng lượng mặt trời. Cửa khóa vân tay. Wìfi. Giờ giấc tự do. Nhà rất sạch sẽ và yên tĩnh.,,,Hải trương, 0934928409," 7 ,triệu/tháng",Tin miễn phí, Chinh chủ cho thuê phòng trọ fun nội thất mới đẹp. Không qua trung gian. 195/18/11 lê văn sỹ ,1,https://bds123.vn/chinh-chu-cho-thue-phong-tro-fun-noi-that-moi-dep-khong-qua-trung-gian-195-18-11-le-van-sy-pr758340.html
 25 m,"Địa chỉ: 142/36b Đường Nguyễn Thị Thập, Phường Bình Thuận, Quận 7, Hồ Chí Minh",,,121451,"Thứ hai, 15:20 04/12/2023","- Cho thuê phòng trọ tại: 142/36B, Nguyễn Thị Thập, Quận 7, kế bên siêu thị Lotte Mart, cầu Kênh Tẻ, gần các Trường Đại Học: ĐH Tôn Đức Thắng, TC Marketing, ĐH Ngân hàng, ĐH Nguyễn Tất Thành,.....đi qua quận 1, q3, q4, q8, q5, đều rất gần.,- Phòng mới xây, sạch đẹp như hình, có gác đúc kiên cố, có tolet trong phòng, có kệ bếp nấu ăn, cửa sổ thoáng mát, không chung chủ nhà, không gian sống lý tưởng.,- Diện tích từ: 25m2 - 30m2 - 50m2.,Tất cả phòng đều CÓ MÁY LẠNH, GÁC LỬNG, TỦ BẾP, WC.,+ Giá: 2.8tr/th,+ Giá: 3tr/th,+ Giá: 3.3tr - 3.5tr/phòng - (CÓ MÁY LẠNH, GÁC LỬNG, BẾP),+ Phòng lớn: 50m2, gồm có: phòng ngủ, phòng khách, bếp, tolet, có ban công rất rộng thoáng mát, đẹp như căn hộ mini, thích hợp ở gia đình, hoặc 4-5 người - giá thuê: 5tr/th.,- Có tủ bếp nấu ăn, wifi, chổ đậu xe an toàn có gắn camera chống trộm và có bảo vệ trông coi, khu vực an ninh yên tĩnh, sạch sẽ, gần chợ, trung tâm.....xem phòng là thích ngay.,- Muốn xem phòng các bạn gọi hẹn trước:----> 0938.046.907,- Địa chỉ: 142/36b Nguyễn Thị Thập, Quận 7 - (gần LOTTE Quận 7)",,https://bds123.cdn.static123.com/images/thumbs/900x600/fit/2019/01/02/img-0011_1546410024.jpg,Oanh, 0938046907," 3 ,triệu/tháng",Tin thường," Phòng trọ mới, rất đẹp, có gác rộng, tủ bếp, tolet riêng, gần LOTTE Q7 ",1,https://bds123.vn/phong-tro-moi-rat-dep-co-gac-rong-tu-bep-tolet-rieng-gan-lotte-q7-pr121451.html
 104 m,"Địa chỉ: Saigon South Residences - 113A Đường Nguyễn Hữu Thọ, Xã Phước Kiển, Huyện Nhà Bè, Hồ Chí Minh", 2 wc , 3 pn ,747201,"Thứ bảy, 15:29 04/11/2023","CHO THUÊ Căn hộ chung cư SaiGon South:,- Diện tích: 104m2, 3PN, 2WC,- Full nội thất siêu cao cấp: tv, tủ lạnh, máy lạnh, giường, nệm, bếp, bàn ăn, sofa,....,- Giá 17tr/tháng,- Nhà mới, sạch sẽ, thoát mát, rộng rãi,*Không chỉ sở hữu căn hộ siêu đẹp, quý khách còn sở hữu cả hệ thống tiện ích đẳng cấp: ,Tiện ích nội khu:,+ Hồ bơi tràn, phòng gym.,+ Công viên nội khu, sân bóng, khu vui chơi trẻ em.,+ Nướng BBQ ngoài trời.,+ Café, trà sữa, cửa hàng tiện lợi, siêu thị, nhà hàng ăn uống, trung tâm thương mại,..,+ Bãi giữ xe rộng, chống ngập,Tiện ích ngoại khu:,+ Đặc biệt với vị trí tiếp giáp mặt tiền đường lớn, ngay trung tâm thuận tiện đi Q1, Q4, Q10,....,+ Gần Lotte Mart,+ Gần trường quốc tế RMIT và các trường đại học danh tiếng khác,+ Gần các bệnh viện uy tín: FV, Nam Sài Gòn...,+ Gần Trung tâm Hội chợ & triển lãm Sài Gòn SECC,+ Gần các khu vui chơi, ăn uống sầm uất,* Cập nhật căn hộ giá rẻ khu vực quận 7, Nhà Bè:,SUNRISE RIVERSIDE:,Căn hộ 2PN: 15 - 17 triệu/tháng. (70 - 90 m²).,Căn hộ 3PN: 18-20 triệu/tháng. (85-100 m²).,SUNRISE CITY:,Căn hộ 2PN: 17 - 20 triệu/tháng. (70 - 90 m²).,Căn hộ 3PN: 26 - 28 triệu/tháng. (120 - 150 m²).,Tại DU NHIÊN có cho thuê tất cả các loại hình căn hộ khu vực quận 7, Nhà Bè, giá siêu tốt, siêu ưu đãi cho khách hàng khi kí hợp đồng.,Nhanh tay liên hệ ngay 098.3839.578 ( Call/Zalo/WhatsApp) hoặc Fanpage https://www.facebook.com/TaphoaHomes để sở hữu ngay căn hộ đẹp với giá tốt !!!",,https://bds123.cdn.static123.com/images/thumbs/900x600/fit/2023/11/04/z4819193333254-b4145d9c4f9d9ef84c737342311ad463_1699084079.jpg,Du Nhiên Du Nhiên, 0983839578," 17 ,triệu/tháng", Saigon South Residences ," Cho thuê căn hộ chung cư SG South Q7-3PN, 104m2. LH: 0983839578. ",1,https://bds123.vn/cho-thue-can-ho-chung-cu-sg-south-q7-3pn104m2-lh-0983839578-pr747201.html
 400 m,"Địa chỉ: Đường Nguyễn Thái Bình, Phường Nguyễn Thái Bình, Quận 1, Hồ Chí Minh",,,745544,"Thứ sáu, 15:28 01/12/2023","-Tòa nhà mặt tiền Nguyễn Thái Bình, Q.1, TP.HCM. NGAY CHỢ DÂN SINH,-Có vị trí đắc địa, nằm trên trục đường chính 2 chiều, khu thị tứ, gần chợ bến thành, nhà ga Metro Bến Thành, công viên 23/9 rộng rãi, thoáng mát, an ninh. Giao thông thuận tiện khách vào sử dụng ngay, không cần set up nhiều, view đẹp, toilet riêng biệt.,-Có thang máy, máy lạnh, hầm để xe,…,-Diện tích: 88m2/sàn,-Giá thuê từng tầng:,+Tầng trệt: 25.000.000 VNĐ,+Lững: 12.000.000 VNĐ,+Lầu 1: 15.000.000 VNĐ,+Lầu 2: 15.000.000 VNĐ,-Giá thuê toàn bộ: Tầng hầm, tầng trệt, lững, lầu 1, lầu 2: 60.000.000 VNĐ",,https://bds123.cdn.static123.com/images/thumbs/900x600/fit/2023/11/01/img-4084_1698826611.jpg,Hoàng Anh, 0909700079," 60 ,triệu/tháng",Tin miễn phí," Chính chủ cho thuê văn phòng mặt tiền Nguyễn Thái Bình, rẻ nhất Quận 1. ",1,https://bds123.vn/chinh-chu-cho-thue-vp-mat-tien-nguyen-thai-binh-re-nhat-q1-pr745544.html
 126 m,"Địa chỉ: 512 Đường Nguyễn Xiển, Phường Long Thạnh Mỹ, Quận 9, Hồ Chí Minh", 2 wc , 2 pn ,757611,"Thứ sáu, 15:28 08/12/2023","NHÀ PHỐ VINHOMES QUẬN 9 CHO THUÊ NGUYÊN CĂN 17 TRIỆU HOÀN THIỆN TRỆT VÀ LẦU 1,- Loại căn: Nhà phố vinhomes grand park,- Diện tích: 126m2,- Tình trạng: đã hoàn thiện trệt + lầu 1,- Xây dựng: 1 trệt, 4 lầu, 1 áp mái,- Gía cho thuê: 17 triệu ( trệt + lầu 1) riêng tư k chung chủ,Ngoài ra em Nga còn sẵn nhiều căn cho thuê tầng và nguyên căn giá tốt anh chị tham khảo thêm.,✅ NHÀ PHỐ HOÀN THIỆN CHO THUÊ TẦNG,- 109m2 - 6 triệu/ tầng 3,4,- 84m2- 7 triệu/ tầng 3 ( sẵn máy lạnh + rèm, sát vincom),- 84m2 - 8 triệu/ tầng 1,- 126m2 - 8 triệu/ tầng 2,3,4.,- 84m2 - 8 triệu/ tầng 1,- 200m2 - 9 triệu/ tầng,- 162m2 - 10 triệu/ tầng 3,4,- 132m2 - 17 triệu/ trệt,- 126m2 - 17 triệu/ trệt + lầu 1.,- 162m2- 20 triệu/ trệt,✅ NHÀ PHỐ HOÀN THIỆN 5 TẦNG,- 84m2 - 23 triệu ( k thang máy),- 84m2 - 30 triệu ( có thang máy, có máy lạnh),- 84m2 - 32 triệu ( full nội thất 1 tầng, có thang máy),- 126m2 - 20 triệu ( 4 tầng, có thang máy, chung chủ),- 126m2 - 35 triệu ( có thang máy),- 180m2 - 40 triệu ( có thang máy),- 250m2 - 40 triệu ( k thang máy),- 200m2- 45 triệu ( có thang máy),- 180m2 - 50 triệu ( có thang máy, full nội thất 1 tầng),☎ Liên hệ: 0976977110. ( NGA NGUYỄN), Minh Tín Land: D9-64 Manhattan vinhomes grand park quận 9", Tây Bắc ,,Nguyễn Thị Thùy Nga, 0976977110," 17 ,triệu/tháng",Tin thường," Nhà phố Vinhomes Quận 9 cho thuê nguyên căn, giá 17 triệu, hoàn thiện trệt và lầu 1. ",1,https://bds123.vn/nha-pho-vinhomes-quan-9-cho-thue-nguyen-can-17-trieu-hoan-thien-tret-va-lau-1-pr757611.html
 18 m,"Địa chỉ: 21/1 Đường Trường Sơn, Phường 4, Tân Bình, Hồ Chí Minh",,,144839,"Thứ bảy, 15:37 02/12/2023","+ Tôi chính chủ cần cho thuê phòng đẹp, rộng rãi với nhiều tiện ích tuyệt vời và vị trí tốt: Đi bộ đến sân bay Tân Sơn Nhất, công viên Hoàng Văn Thụ.,+ Diện tích: 18m2.,+ Phòng có kệ bếp, có cửa sổ, hướng Đông nên rất mát vào buổi sáng và buổi chiều.,+ Nhà có chỗ để xe rộng rãi với camera an ninh 24/24 rất an toàn.,+ Khoá vân tay, giờ giấc tự do cho bạn cảm giác như ở chính nhà mình.,+ Khu dân cư an ninh, yên tĩnh, là nơi ở lý tưởng cho các bạn sinh viên, nhân viên văn phòng, tiếp viên hàng không hay một gia đình nhỏ.,+ Vị trí thuận lợi: Ngay ngã ba Hậu Giang Trường Sơn, Ngay cùng phía đường ra sân bay (có thể đi bộ được), gần ngã ba công viên Hoàng Văn Thụ, tiện đi lại mọi nơi trong thành phố.,+ Giá rất hợp lý: 2.5 triệu/tháng (Giá giảm sâu và không tăng giá).,Liên hệ: 0937554570 (A. Hoàng).,Địa chỉ: 21/1 Trường Sơn, P. 4, Q. Tân Bình.",,https://bds123.cdn.static123.com/images/thumbs/900x600/fit/2022/04/06/9fa12a540361cb3f9270_1649197876.jpg,Hoang Le, 0937554570," 2.5 ,triệu/tháng",Tin thường," Phòng đẹp cho thuê 21/1 đường Trường Sơn, P. 4, Q.Tân Bình, DT: 18m2 - (Gần Sân Bay, Công Viên) ",1,https://bds123.vn/phong-dep-cho-thue-7a-9-thanh-thai-quan-10-dt-30m2-co-giuong-ke-bep-cua-so-pr144839.html
 120 m,"Địa chỉ: Đường Quan Hoa, Phường Quan Hoa, Cầu Giấy, Hà Nội",,,752561,"Thứ năm, 15:15 14/12/2023","Chính chủ cần cho thuê MBKD tại 189 Quan Hoa - Nguyễn Khánh Toàn,- DT 120m2, MT 8,5m, sàn mới đẹp.,1. Vị trí đắc địa.,- Nhà phố 189 Quan Hoa giao Nguyễn Khánh Toàn. Đường rộng ô tô đi lại thoải mái, khu kinh doanh sầm uất, giao thương thuận tiện.,- Nằm trong khu đông dân cư, nhiều văn phòng, ngân hàng, khu dân trí cao, an ninh cực tốt.,2. Đặc điểm MBKD,- Diện tích xây dựng: 120m2 thông sàn, MT 8,5m cửa kính thoáng sáng view Lotte.,- Điện nước đầy đủ, bàn giao trần sàn, điều hòa, WC khép kín.,- Có thang máy, hầm để xe rộng rãi, bảo vệ an ninh 24/24.,- Phù hợp mô hình kinh doanh sạch sẽ,3. Giá cho thuê: 26 triệu/tháng (có thương lượng),Liên hệ: Ms Thơm 0344938171 (call/zalo)",,https://bds123.cdn.static123.com/images/thumbs/900x600/fit/2023/11/14/382489301-2508364289342221-8979135141214766843-n_1699945895.jpg,Nguyễn Thị Thơm, 0344938171," 26 ,triệu/tháng",Tin miễn phí, Chính chủ cho thuê mbkd số 189 Quan Hoa diện tích 120m2 giá chỉ 26 triệu ,1,https://bds123.vn/chinh-chu-cho-thue-mbkd-so-189-quan-hoa-dien-tich-120m2-gia-chi-26-trieu-pr752561.html
